{
  "schemaVersion": "g0-decision-manifest-v1",
  "manifestId": "stage12-g0-contract-v1",
  "familyId": "spherical-sun-stars-radial-v1",
  "experimentRoots": {
    "source": "experiments/extraterrestrial",
    "output": "tmp/extraterrestrial"
  },
  "baselineManifest": {
    "path": "experiments/extraterrestrial/baseline-manifest.json",
    "aggregateHash": "sha256:515987a60fdf661ef283e42bcf436c1bc5baf0a8768e33969a53e49da097612d"
  },
  "candidateSeed": {
    "aggregateHash": "sha256:515987a60fdf661ef283e42bcf436c1bc5baf0a8768e33969a53e49da097612d",
    "identicalToBaseline": true
  },
  "schemas": [
    {
      "id": "celestial-contract-v1",
      "version": "1",
      "path": "experiments/extraterrestrial/schemas/celestial-contract-v1.schema.json",
      "sha256": "sha256:5a23bb28df556c5f7870c3a4f4724bc025ebbf149cdf669df461ce2c49c41f81"
    },
    {
      "id": "g0-decision-manifest-v1",
      "version": "1",
      "path": "experiments/extraterrestrial/schemas/g0-decision-manifest-v1.schema.json",
      "sha256": "sha256:74489357e916b900915e0ef8d30c231b6e8541cd137393ab2121c4307d4211b9"
    }
  ],
  "fixtures": [
    {
      "id": "g0-synthetic-celestial-v1",
      "version": "1",
      "path": "experiments/extraterrestrial/fixtures/g0-synthetic-celestial-v1.json",
      "sha256": "sha256:72bd8c0f378bbf6e8d1006c68088fcb568dd68c39ece90df0793c54e666e7b10"
    }
  ],
  "decisions": [
    {
      "id": "architecture.owner-map",
      "status": "fixed",
      "value": {
        "source": "radiometry-and-celestial-placement-facts",
        "geometry": "transforms-cache-coordinates-and-controller-creation",
        "atmosphere": "direct-transport-physics",
        "celestialCache": "generation-identity-fields-lookup-publication-and-disposal",
        "rasterVisibility": "live-source-resolution-projection-and-visibility",
        "color": "spectral-to-display-conversion",
        "runner": "orchestration-and-observation-only"
      },
      "constraints": [
        "Provisional code retains the eventual production ownership boundaries.",
        "Runners may not absorb source, geometry, atmosphere, cache, raster, visibility, or Color responsibilities."
      ],
      "ownerGoal": "G0",
      "changeRule": "Changing ownership requires a versioned design decision and a new qualifying boundary proof.",
      "rationale": "The experiment may be provisional, but architectural ownership is not."
    },
    {
      "id": "architecture.cache-slots",
      "status": "fixed",
      "value": {
        "scatteringCache": {
          "creator": "light-source",
          "quantity": "cumulative-scattering-density",
          "use": "inside-ordinary-path-transport"
        },
        "celestialCache": {
          "creator": "geometry",
          "quantity": "transported-celestial-source-measures",
          "use": "live-source-raster-after-path-transport"
        },
        "identityLifecycleAndBindings": "separate"
      },
      "constraints": [
        "The celestial cache is not encoded as the scattering cache.",
        "Neither cache borrows the other cache's identity, publication slot, resources, or disposal."
      ],
      "ownerGoal": "G0",
      "changeRule": "Changing the slot split requires a versioned architecture decision and a new G0-equivalent proof.",
      "rationale": "The two caches hold different physical quantities and enter the algorithm at different points."
    },
    {
      "id": "composition.order",
      "status": "fixed",
      "value": {
        "equation": "preDisplayRadiance = pathRadiance + celestialRadiance",
        "additionCount": 1,
        "after": "ordinary-atmosphere-path-transport",
        "before": "Color",
        "sidecarRenderer": false
      },
      "constraints": [
        "Celestial spectra flow naturally through the spectral pipeline.",
        "Color remains the only spectral-to-display conversion owner."
      ],
      "ownerGoal": "G0",
      "changeRule": "Changing the insertion point or addition count requires a versioned design decision and a new quantity-route proof.",
      "rationale": "This preserves spectral information through atmosphere transport and prevents duplicate conversion or composition."
    },
    {
      "id": "spectral.native-15-basis",
      "status": "fixed",
      "value": {
        "id": "algorithm32-native-15-spectral-basis-v1",
        "channelCount": 15,
        "contentHash": "sha256:a03a3c7f45d9bd4ff8adf6482e9d1aac1acd72423758ecf797ac24f6dffba891"
      },
      "constraints": [
        "Every first-family source and cached result uses the sealed production channel centers and widths.",
        "Basis conversion is not performed inside the celestial cache."
      ],
      "ownerGoal": "G0",
      "changeRule": "A basis change requires a new family or versioned contract and complete requalification.",
      "rationale": "A shared typed basis is required for exact spectral composition before Color."
    },
    {
      "id": "source.quantity-contract",
      "status": "fixed",
      "value": {
        "infinitePoint": {
          "inputAndCacheMeasure": "spectral-irradiance-density",
          "units": "W m^-2 nm^-1"
        },
        "distantUniformDisk": {
          "inputAndCacheMeasure": "spectral-radiance-density",
          "units": "W m^-2 sr^-1 nm^-1"
        },
        "pointRadianceConversion": "normalized-response-divided-by-exact-pixel-solid-angle-once"
      },
      "constraints": [
        "Point irradiance and extended radiance remain distinct typed measures.",
        "Atmosphere transport is already applied when the cache returns either measure."
      ],
      "ownerGoal": "G0",
      "changeRule": "A quantity or unit change requires a versioned schema and renewed conservation proof.",
      "rationale": "Point and extended sources contribute radiance differently even though both have a rendering need."
    },
    {
      "id": "roster.first-family",
      "status": "fixed",
      "value": {
        "layers": [
          {
            "layerId": "stars",
            "kind": "infinite-point-set",
            "composition": "additive",
            "memberOrder": "sourceId-ascending"
          },
          {
            "layerId": "sun",
            "kind": "distant-extended",
            "profile": "uniform-disk",
            "composition": "additive"
          }
        ],
        "foregroundOf": [],
        "opacity": false
      },
      "constraints": [
        "The star field acts as one layer while retaining individually addressable members.",
        "The first family has exactly two layers, zero foreground edges, and no opacity."
      ],
      "ownerGoal": "G0",
      "changeRule": "Changing layer kind, order, composition, or edges requires a different qualified family.",
      "rationale": "Sun and stars are sufficient for the first cache proof; Moon ordering is an explicit follow-up."
    },
    {
      "id": "identity.static-vs-live",
      "status": "fixed",
      "value": {
        "physicalFieldIncludes": [
          "static-source-definitions",
          "provider-contract",
          "atmosphere-transport",
          "geometry-family-domain",
          "spectral-basis",
          "numerical-policy",
          "layer-roster"
        ],
        "physicalFieldExcludes": [
          "evaluated-placement",
          "receiver",
          "observation",
          "camera",
          "viewport",
          "display"
        ],
        "queryStateIncludes": [
          "evaluated-placement",
          "receiver",
          "observation"
        ]
      },
      "constraints": [
        "Compatible placement-only changes reuse the physical field.",
        "Static-definition and provider-contract changes rebuild the generation."
      ],
      "ownerGoal": "G0",
      "changeRule": "Changing identity projections requires a versioned family contract and lifecycle requalification.",
      "rationale": "Placement can move through a symmetric field without turning camera or epoch into physical cache axes."
    },
    {
      "id": "identity.camera-exclusion",
      "status": "fixed",
      "value": {
        "excludedFromPhysicalField": [
          "orientation",
          "projection",
          "fov",
          "viewport",
          "pixelRatio",
          "pixelCoordinate",
          "pointResponse",
          "sceneDepth",
          "exposure",
          "display"
        ],
        "excludedFromQueryStateWhenReceiverIsFixed": true,
        "cameraRole": "live-raster-only"
      },
      "constraints": [
        "A renderer camera may designate the physical receiver only through geometry.",
        "Camera-only changes do not rebuild or re-key the transported field."
      ],
      "ownerGoal": "G0",
      "changeRule": "Admitting camera state into cache identity requires a new architecture and full requalification.",
      "rationale": "The cache is a camera-independent field, not an image or camera-bound frame cache."
    },
    {
      "id": "live-state.packet-semantics",
      "status": "fixed",
      "value": {
        "mutability": "immutable-packet",
        "route": "cheap-live-ingress-bypassing-full-setConfig",
        "contents": [
          "evaluated-placement-states",
          "observation-and-body-orientation-state",
          "geometry-mapped-receiver-state",
          "generation-compatible-roster-reference"
        ],
        "transportedPayloadAllowed": false,
        "cameraAllowed": false
      },
      "constraints": [
        "The packet cannot redefine static source membership or radiometry.",
        "Geometry validates frame/provider compatibility before producing a query packet."
      ],
      "ownerGoal": "G0",
      "changeRule": "Semantic changes require a versioned packet contract and new identity proof; only names remain provisional.",
      "rationale": "Live celestial/geographic state must update cheaply without polluting static facade configuration."
    },
    {